{
  "$schema": "https://json-schema.org/draft/2020-12/schema",
  "$id": "https://example.com/schemas/content-draft.schema.json",
  "title": "ContentDraft",
  "type": "object",
  "additionalProperties": false,
  "properties": {
    "hero_title": { "type": "string" },
    "one_line_intro": { "type": "string" },
    "company_intro": { "type": "string" },
    "business_summary": { "type": "string" },
    "core_strengths": {
      "type": "array",
      "items": { "type": "string", "minLength": 1 },
      "maxItems": 10
    },
    "tags": {
      "type": "array",
      "items": { "type": "string", "minLength": 1 },
      "maxItems": 12
    },
    "section_visibility": {
      "type": "object",
      "additionalProperties": false,
      "properties": {
        "company_summary": { "type": "boolean" },
        "contact_info": { "type": "boolean" },
        "company_intro": { "type": "boolean" },
        "core_strengths": { "type": "boolean" },
        "history": { "type": "boolean" },
        "portfolio": { "type": "boolean" },
        "featured_products": { "type": "boolean" },
        "product_area": { "type": "boolean" },
        "product_registration_cta": { "type": "boolean" },
        "contact_cta": { "type": "boolean" }
      }
    },
    "section_layout": {
      "type": "object",
      "additionalProperties": false,
      "properties": {
        "core_strengths": { "type": "string", "enum": ["list", "grid_2"] },
        "history": { "type": "string", "enum": ["timeline", "compact"] },
        "portfolio": { "type": "string", "enum": ["list", "grid_2"] },
        "featured_products": { "type": "string", "enum": ["grid_2", "grid_3"] },
        "product_area": { "type": "string", "enum": ["grid_2", "grid_3"] }
      }
    },
    "content_density": { "type": "string", "enum": ["compact", "standard", "rich"] },
    "design_tokens": {
      "type": "object",
      "additionalProperties": false,
      "properties": {
        "primary": { "type": "string", "enum": ["#2f6fed", "#12a37f", "#4f7fe8", "#264f9d", "#0f766e", "#334155"] },
        "accent": { "type": "string", "enum": ["#2f6fed", "#12a37f", "#4f7fe8", "#264f9d", "#0f766e", "#334155"] },
        "radius": { "type": "string", "enum": ["none", "sm", "md", "lg"] }
      }
    },
    "section_order": {
      "type": "array",
      "uniqueItems": true,
      "items": {
        "type": "string",
        "enum": ["hero", "company_summary", "company_intro", "core_strengths", "contact_info", "history", "portfolio", "featured_products", "product_area", "product_registration_cta", "contact_cta"]
      }
    },
    "block_overrides": {
      "type": "object",
      "propertyNames": {
        "enum": ["hero", "company_summary", "company_intro", "core_strengths", "contact_info", "history", "portfolio", "featured_products", "product_area", "product_registration_cta", "contact_cta"]
      },
      "additionalProperties": {
        "type": "object",
        "additionalProperties": false,
        "properties": {
          "emphasis": { "type": "string", "enum": ["default", "strong"] }
        }
      }
    },
    "hero_image_theme": { "type": "string" },
    "hero_image_keywords": {
      "type": "array",
      "items": { "type": "string", "minLength": 1 },
      "maxItems": 8
    },
    "homepage_plan": {
      "$ref": "homepage-plan.schema.json"
    },
    "cta_text": { "type": "string" }
  }
}
